{
  "case_id": "CASE_BFB2599E145D",
  "components": {
    "ci": {
      "items": [],
      "status": "not_assessed"
    },
    "discussion": {
      "items": [],
      "status": "not_assessed"
    },
    "issue": {
      "items": [],
      "status": "not_assessed"
    },
    "pr": {
      "items": [
        {
          "availability_status": "unavailable",
          "historical_timestamp": "2023-11-30T09:19:13Z",
          "provenance_reference": "cases/reconstruction/CASE_BFB2599E145D/evidence/current_pr_metadata_sanitized.json",
          "retrieval_timestamp": "2026-10-01T18:35:15.151501+00:00",
          "source": "https://api.github.com/repos/hufscheer/web-v1/pulls/119",
          "source_type": "pull_request",
          "stable_identifier": "hufscheer/client#119",
          "temporal_relation_to_tFG": "after",
          "timestamp_precision": "timestamp"
        }
      ],
      "status": "unavailable"
    },
    "repository": {
      "items": [],
      "status": "not_assessed"
    }
  },
  "historical_index_version": "historical-information-index-v1",
  "methodology_version": "dir-tfg-v2",
  "primary_repository_cutoff": "tFG",
  "reconstruction_contract_version": "post-stage-c-reconstruction-v1",
  "tFG": {
    "precision": "timestamp",
    "source": "turn_000003.create_time",
    "status": "derivable",
    "value": "2023-11-30T08:40:22.179209+00:00"
  },
  "target_identity_claims": [
    {
      "adequate_provenance": true,
      "asserted_base_sha": "3a56f30491f7a44e4c49d094e44b1c18ded8cdad",
      "claim_id": "current-pr-base",
      "cross_validated": false,
      "evidence_hash": "ab0102108161b7fb1d6e8ef621eb88dfc0bdd96fa6b55db326e7ea56276b4ce1",
      "evidence_historical_timestamp": "2026-10-01T18:35:15.151501+00:00",
      "evidence_level": "level_4_present_day_pr_metadata",
      "evidence_relation_to_tFG": "after",
      "evidence_source_identifier": "https://api.github.com/repos/hufscheer/web-v1/pulls/119",
      "evidence_source_type": "current_provider_pr_metadata",
      "evidence_status": "supporting_only",
      "evidence_timestamp_precision": "timestamp",
      "provenance_reference": "cases/reconstruction/CASE_BFB2599E145D/evidence/current_pr_metadata_sanitized.json",
      "retrieval_timestamp": "2026-10-01T18:35:15.151501+00:00"
    }
  ]
}
