{
  "case_id": "CASE_EE7F13CD9FB7",
  "components": {
    "ci": {
      "items": [],
      "status": "not_assessed"
    },
    "discussion": {
      "items": [],
      "status": "not_assessed"
    },
    "issue": {
      "items": [],
      "status": "not_assessed"
    },
    "pr": {
      "items": [
        {
          "availability_status": "available",
          "historical_timestamp": "2023-09-04T13:56:14Z",
          "provenance_reference": "cases/reconstruction/CASE_EE7F13CD9FB7/evidence/current_pr_metadata_sanitized.json",
          "retrieval_timestamp": "2026-10-01T18:35:21.672574+00:00",
          "source": "https://api.github.com/repos/darklang/dark/pulls/5058",
          "source_type": "pull_request",
          "stable_identifier": "darklang/dark#5058",
          "temporal_relation_to_tFG": "at_or_before",
          "timestamp_precision": "timestamp"
        }
      ],
      "status": "available"
    },
    "repository": {
      "items": [],
      "status": "not_assessed"
    }
  },
  "historical_index_version": "historical-information-index-v1",
  "methodology_version": "dir-tfg-v2",
  "primary_repository_cutoff": "tFG",
  "reconstruction_contract_version": "post-stage-c-reconstruction-v1",
  "tFG": {
    "precision": "timestamp",
    "source": "turn_000005.create_time",
    "status": "derivable",
    "value": "2023-09-05T01:44:25.726944+00:00"
  },
  "target_identity_claims": [
    {
      "adequate_provenance": true,
      "asserted_base_sha": "53e80a92af83ce6a73614e81765c591bf9a1a1b8",
      "claim_id": "current-pr-base",
      "cross_validated": false,
      "evidence_hash": "d22ba015262c5101895039d59164a65e73d3d925770bbc36ccd92a18a1709e58",
      "evidence_historical_timestamp": "2026-10-01T18:35:21.672574+00:00",
      "evidence_level": "level_4_present_day_pr_metadata",
      "evidence_relation_to_tFG": "after",
      "evidence_source_identifier": "https://api.github.com/repos/darklang/dark/pulls/5058",
      "evidence_source_type": "current_provider_pr_metadata",
      "evidence_status": "supporting_only",
      "evidence_timestamp_precision": "timestamp",
      "provenance_reference": "cases/reconstruction/CASE_EE7F13CD9FB7/evidence/current_pr_metadata_sanitized.json",
      "retrieval_timestamp": "2026-10-01T18:35:21.672574+00:00"
    }
  ]
}
